[
  {
    "id": "128f2348-99d4-40a1-b5ab-91d9019f272d",
    "title": "Sample Application Cycle",
    "description": "This application cycle is just a sample.",
    "events": {
      "open": {
        "id": "open",
        "title": "Application Window Opened",
        "messages": [
          "Applications are not yet being accepted.",
          "Applications are being accepted."
        ],
        "conditions": [
          [
            {
              "name": "date",
              "options": {
                "mode": "after",
                "date": {
                  "$reql_type$": "TIME",
                  "epoch_time": 1405203171.364,
                  "timezone": "+00:00"
                }
              }
            }
          ]
        ],
        "listeners": []
      },
      "warning": {
        "id": "warning",
        "title": "Application Window Closing Soon",
        "messages": [
          "This project is not in jeopardy of missing the application window.",
          "This project is in jeopardy of missing the application window."
        ],
        "conditions": [
          [
            {
              "name": "date",
              "options": {
                "mode": "after",
                "date": {
                  "$reql_type$": "TIME",
                  "epoch_time": 1405803171.364,
                  "timezone": "+00:00"
                }
              }
            },
            {
              "name": "regex",
              "options": {
                "regex": "^complete$",
                "invert": true,
                "pointer": "/flow/stages/submission/status"
              }
            }
          ]
        ],
        "listeners": [
          {
            "name": "email",
            "options": {
              "value": true,
              "roles": [
                "applicant",
                "advisor"
              ],
              "template": "Don't get left behind!"
            }
          }
        ]
      },
      "close": {
        "id": "close",
        "title": "Application Window Closed",
        "messages": [
          "Applications are still open.",
          "Applications are no longer being accepted."
        ],
        "conditions": [
          [
            {
              "name": "date",
              "options": {
                "mode": "after",
                "date": {
                  "$reql_type$": "TIME",
                  "epoch_time": 1406203171.364,
                  "timezone": "+00:00"
                }
              }
            }
          ]
        ],
        "listeners": []
      },
      "complete": {
        "id": "complete",
        "title": "Application Complete",
        "messages": [
          "The application is not yet complete.",
          "The application is complete."
        ],
        "conditions": [
          [
            {
              "name": "regex",
              "options": {
                "regex": "^complete$",
                "pointer": "/flow/stages/start/status"
              }
            },
            {
              "name": "regex",
              "options": {
                "regex": "^complete$",
                "pointer": "/flow/stages/team/status"
              }
            },
            {
              "name": "regex",
              "options": {
                "regex": "^complete$",
                "pointer": "/flow/stages/application/status"
              }
            }
          ]
        ],
        "listeners": []
      },
      "submit": {
        "id": "submit",
        "title": "Officially Submitted",
        "messages": [
          "This project has not yet been submitted.",
          "This project has been submitted."
        ],
        "conditions": [
          [
            {
              "name": "regex",
              "options": {
                "regex": "^complete$",
                "pointer": "/flow/stages/submission/status"
              }
            }
          ]
        ],
        "listeners": []
      },
      "report": {
        "id": "report",
        "title": "Report Submitted",
        "messages": [
          "This project's report has not yet been submitted.",
          "This project's report has been submitted."
        ],
        "conditions": [
          [
            {
              "name": "regex",
              "options": {
                "regex": "^complete$",
                "pointer": "/flow/stages/report/status"
              }
            }
          ]
        ],
        "listeners": []
      },
      "archive": {
        "id": "archive",
        "title": "Archived",
        "messages": [
          "This project is not archived.",
          "This project has been archived."
        ],
        "conditions": [
          [
            {
              "name": "regex",
              "options": {
                "regex": "^archived$",
                "pointer": "/status"
              }
            }
          ]
        ],
        "listeners": []
      },
      "accept": {
        "id": "accept",
        "title": "Accepted",
        "messages": [
          "This project has not yet been accepted.",
          "This project has been accepted."
        ],
        "conditions": [
          [
            {
              "name": "regex",
              "options": {
                "regex": "^accepted$",
                "pointer": "/status"
              }
            }
          ]
        ],
        "listeners": []
      },
      "reject": {
        "id": "reject",
        "title": "Rejected",
        "messages": [
          "This project is not rejected.",
          "This project has been rejected."
        ],
        "conditions": [
          [
            {
              "name": "regex",
              "options": {
                "regex": "^rejected$",
                "pointer": "/status"
              }
            }
          ]
        ],
        "listeners": []
      }
    },
    "root": "start",
    "flow": {
      "start": {
        "id": "start",
        "title": "Start",
        "description": "Start your application!",
        "visible": [
          "staff",
          "applicant",
          "advisor",
          "reviewer"
        ],
        "lock": {
          "open": [
            "open"
          ],
          "close": [
            "submit",
            "archive",
            "close"
          ]
        },
        "component": {
          "name": "start",
          "options": {
            "next": "team",
            "role": "applicant",
            "permissions": {
              "write": [
                "staff",
                "applicant"
              ]
            }
          }
        },
        "next": [
          "team"
        ]
      },
      "team": {
        "id": "team",
        "title": "Team",
        "description": "Build your team by adding collaborators to your application.",
        "visible": [
          "staff",
          "applicant",
          "advisor",
          "reviewer"
        ],
        "lock": {
          "open": [
            "open"
          ],
          "close": [
            "submit",
            "archive",
            "close"
          ]
        },
        "component": {
          "name": "users",
          "options": {
            "next": "application",
            "roles": [
              "applicant",
              "advisor"
            ],
            "permissions": {
              "assign": [
                "staff",
                "applicant"
              ],
              "remove": [
                "staff",
                "applicant"
              ]
            }
          }
        },
        "next": [
          "supplement"
        ]
      },
      "application": {
        "id": "application",
        "title": "Application Form",
        "description": "Fill out our online application form.",
        "visible": [
          "staff",
          "applicant",
          "advisor",
          "reviewer"
        ],
        "lock": {
          "open": [
            "open"
          ],
          "close": [
            "submit",
            "archive",
            "close"
          ]
        },
        "component": {
          "name": "form",
          "options": {
            "next": "assignment",
            "permissions": {
              "read": [
                "staff",
                "applicant",
                "advisor",
                "reviewer"
              ],
              "write": [
                "staff",
                "applicant"
              ]
            }
          }
        },
        "next": [
          "submission"
        ]
      },
      "submission": {
        "id": "submission",
        "title": "Official Submission",
        "description": "Officially submit your application. Once submitted, your application can no longer be edited.",
        "visible": [
          "staff",
          "applicant",
          "advisor",
          "reviewer"
        ],
        "lock": {
          "open": [
            "open",
            "complete"
          ],
          "close": [
            "submit",
            "archive",
            "close"
          ]
        },
        "component": {
          "name": "form",
          "options": {
            "next": "acknowledgment",
            "permissions": {
              "read": [
                "staff",
                "applicant",
                "advisor",
                "reviewer"
              ],
              "write": [
                "staff",
                "applicant"
              ]
            }
          }
        },
        "next": [
          "acknowledgment"
        ]
      },
      "acknowledgment": {
        "id": "acknowledgment",
        "title": "Submission Acknowledgment",
        "description": "This page acknowledges that the application was received.",
        "visible": [
          "applicant",
          "advisor"
        ],
        "lock": {
          "open": [
            "submit"
          ],
          "close": [
            "accept",